{
  "$id": "bureau_episode_learning_v1.schema.json", "$schema": "https://json-schema.org/draft/2020-12/schema",
  "type": "object", "additionalProperties": false,
  "required": ["schema_version", "artifact_type", "artifact_id", "property_id", "episode_id", "created_at", "generator_version", "upstream_artifacts", "metrics_state", "platform", "impressions", "views", "completion_rate_basis_points", "retention_basis_points", "rewatches", "saves", "shares", "comments", "profile_visits", "follows", "click_through_basis_points", "revenue_cents", "confidence_basis_points", "allowed_learning_conclusions", "prohibited_overfitting_conclusions", "canon_override_permitted"],
  "properties": {
    "schema_version": {"$ref": "common_defs_v1.schema.json#/$defs/schema_version"}, "artifact_type": {"const": "bureau_episode_learning_v1"}, "artifact_id": {"$ref": "common_defs_v1.schema.json#/$defs/artifact_id"}, "property_id": {"$ref": "common_defs_v1.schema.json#/$defs/property_id"}, "episode_id": {"$ref": "common_defs_v1.schema.json#/$defs/episode_id"}, "created_at": {"$ref": "common_defs_v1.schema.json#/$defs/created_at"}, "generator_version": {"$ref": "common_defs_v1.schema.json#/$defs/generator_version"}, "upstream_artifacts": {"$ref": "common_defs_v1.schema.json#/$defs/upstream_artifacts"},
    "metrics_state": {"enum": ["awaiting_publication", "awaiting_metrics", "available"]}, "platform": {"enum": ["none", "instagram", "tiktok", "youtube_shorts", "other"]}, "impressions": {"type": ["integer", "null"], "minimum": 0}, "views": {"type": ["integer", "null"], "minimum": 0}, "completion_rate_basis_points": {"type": ["integer", "null"], "minimum": 0, "maximum": 10000}, "retention_basis_points": {"type": ["integer", "null"], "minimum": 0, "maximum": 10000}, "rewatches": {"type": ["integer", "null"], "minimum": 0}, "saves": {"type": ["integer", "null"], "minimum": 0}, "shares": {"type": ["integer", "null"], "minimum": 0}, "comments": {"type": ["integer", "null"], "minimum": 0}, "profile_visits": {"type": ["integer", "null"], "minimum": 0}, "follows": {"type": ["integer", "null"], "minimum": 0}, "click_through_basis_points": {"type": ["integer", "null"], "minimum": 0, "maximum": 10000}, "revenue_cents": {"type": ["integer", "null"], "minimum": 0}, "confidence_basis_points": {"type": "integer", "minimum": 0, "maximum": 10000}, "allowed_learning_conclusions": {"$ref": "common_defs_v1.schema.json#/$defs/string_list"}, "prohibited_overfitting_conclusions": {"$ref": "common_defs_v1.schema.json#/$defs/string_list"}, "canon_override_permitted": {"const": false}
  }
}
