{
  "schema_version": "itb_artifact_v1",
  "artifact_type": "bureau_episode_learning_v1",
  "artifact_id": "itb_ep_001_episode_learning_v1",
  "property_id": "interstitial_travel_bureau",
  "episode_id": "itb_ep_001",
  "created_at": "2026-08-02T00:15:00Z",
  "generator_version": "itb_authored_pilot_v1",
  "upstream_artifacts": [{"artifact_id": "itb_ep_001_episode_manifest_v1", "sha256": "3555611f1a06046564e8c8af5698a1d1179147f90062923c4e8ebe2f9dd0b037"}],
  "metrics_state": "awaiting_publication",
  "platform": "none",
  "impressions": null,
  "views": null,
  "completion_rate_basis_points": null,
  "retention_basis_points": null,
  "rewatches": null,
  "saves": null,
  "shares": null,
  "comments": null,
  "profile_visits": null,
  "follows": null,
  "click_through_basis_points": null,
  "revenue_cents": null,
  "confidence_basis_points": 0,
  "allowed_learning_conclusions": ["Future validated metrics may influence Creative Genome selection weights.", "Repeated cross-episode evidence may suggest revising shot or hook selection."],
  "prohibited_overfitting_conclusions": ["One episode may not redefine Bureau canon.", "Missing metrics may not be interpreted as zero performance.", "Platform performance may not erase user locks or continuity rules."],
  "canon_override_permitted": false
}
